team_home,team_away,day_of_matchup,days_left,score_diff,starts_left_home,starts_left_away,start_advantage,win_prob,win_prob_lr
Blasphemous Hot Takes,Hader Better Faster Stronger,6,1,59,2,2,0,0.9310991772257291,0.9128334917006509
Framber Valdez Oil Spill,It's Gonna Be Gley,6,1,-76,1,2,-1,0.05846079973108322,0.07606575437300464
All That is Wright,Crown Heights Crusaders,6,1,35.5,1,1,0,0.8450654008459525,0.7978343833844278
Ketel Bells,The Novaks,6,1,31.5,0,1,-1,0.6837923864541462,0.6577852876117949
Mt. Everest Taquito Farmers,The West Bank Occupiers,6,1,-42,1,2,-1,0.1371540597648475,0.18233442348346388
The Traveling Secretaries,Cron's Disease,6,1,84,1,1,0,0.9720485073657258,0.9672940516251568
