team_home,team_away,day_of_matchup,days_left,score_diff,starts_left_home,starts_left_away,start_advantage,win_prob,win_prob_lr
Blasphemous Hot Takes,Cron's Disease,6,1,-36.5,2,2,0,0.14807458613720334,0.16558620429167695
The West Bank Occupiers,The Traveling Secretaries,6,1,-12,2,2,0,0.35169893492046034,0.35439185536890827
The Novaks,Mt. Everest Taquito Farmers,6,1,27,1,2,-1,0.6839624585332095,0.6275123644856107
Crown Heights Crusaders,Ketel Bells,6,1,5,0,0,0,0.5566592744336378,0.5265237878148039
It's Gonna Be Gley,All That is Wright,6,1,-85.5,1,2,-1,0.04586704686570764,0.05866490385519924
Hader Better Faster Stronger,Framber Valdez Oil Spill,6,1,-31,1,2,-1,0.1799724428337258,0.2353695291831484
