team_home,team_away,day_of_matchup,days_left,score_diff,starts_left_home,starts_left_away,start_advantage,win_prob,win_prob_lr
Blasphemous Hot Takes,Ketel Bells,6,1,43,0,2,-2,0.8214766068936716,0.7586491679791388
Mt. Everest Taquito Farmers,All That is Wright,6,1,-126.5,3,0,3,0.019081521455706647,0.011055939838023776
The Traveling Secretaries,Framber Valdez Oil Spill,6,1,-9,3,1,2,0.4431258572505231,0.47286042858212674
Cron's Disease,Hader Better Faster Stronger,6,1,30.5,0,2,-2,0.7106629358703838,0.6600225957731325
The West Bank Occupiers,It's Gonna Be Gley,6,1,-3,1,2,-1,0.4225585030819644,0.41152976020439197
The Novaks,Crown Heights Crusaders,6,1,6,1,1,0,0.5729858292132075,0.5368638191337989
