team_home,team_away,day_of_matchup,days_left,score_diff,starts_left_home,starts_left_away,start_advantage,win_prob,win_prob_lr
The Traveling Secretaries,Bibee-di-Bobbidi-Boo,0,7,0,8,8,0,0.6862115078188809,0.49812692435459077
Tucker? I hardly know her,Mt. Everest Taquito Farmers,0,7,0,8,8,0,0.5168807236048134,0.49812692435459077
Book of Boba Chette,The Talmudic Tunnelers,0,7,0,8,8,0,0.4993291813004332,0.49812692435459077
Ketel Bells,Blasphemous Hot Takes,0,7,0,8,8,0,0.5607430311096557,0.49812692435459077
All That is Wright,The Novaks,0,7,0,8,8,0,0.4139501517268336,0.49812692435459077
Top Gunner: Henderson,The West Bank Occupiers,0,7,0,8,8,0,0.28244206912371383,0.49812692435459077
